{
  "hacp_version": "v0.1-draft",
  "record_kind": "hacp.agent_report",
  "report_id": "report-2026-05-19-001",
  "packet_id": "packet-2026-05-19-001",
  "profile_id": "hacp-base-draft",
  "profile_version": "v0.1-draft",
  "created_at": "2026-05-19T14:45:00Z",
  "created_by": "codex-cli",
  "status": "completed",
  "files_changed": ["schemas/examples/valid/task-packet.valid.json"],
  "behaviour_implemented": "Added canonical non-executing schema fixtures and validation assertions.",
  "verification_performed": ["npm run hacp:doctor -- schemas/examples --manifest schemas/examples/manifest.json"],
  "scope_confirmation": {
    "scope_preserved": true,
    "forbidden_effects_confirmed": ["releases_to_users", "accepts_risk"],
    "out_of_scope_requests": []
  },
  "verification_results": [
    {
      "command": "npm run hacp:doctor -- schemas/examples --manifest schemas/examples/manifest.json",
      "outcome": "pass",
      "summary": "Schema fixtures validated as expected."
    }
  ],
  "linked_finding_ids": [],
  "blockers": [],
  "residual_risks": ["Draft schema semantics may evolve in later profile revisions."],
  "requested_next_human_decision": "request_review",
  "requested_next_step": "request_review",
  "boundaries_preserved": true,
  "boundary_crossed_reason": null,
  "evidence_refs": [
    {
      "ref": "schemas/examples/manifest.json",
      "kind": "command_output",
      "summary": "Fixture validation test results"
    }
  ],
  "evidence": ["schemas/examples/manifest.json"]
}
